<Protocol machine_code="BEAVER_CENSUS" version="1.0" status="experimental" xmlns:xsi="http://www.w3.org/2001/XMLSchema-instance" xsi:noNamespaceSchemaLocation="protocol.xsd">
    <Label>Beaver Census Protocol</Label>
    <Description>Beaver Census Layers</Description>
    <URL>https://lowtechpbr.restoration.usu.edu/</URL>
    <Citation> Wheaton J.M., Bennett S.N., Bouwes, N., Maestas J.D. and Shahverdian S.M. (Editors). 2019. Low-Tech Process-Based Restoration of Riverscapes: Design Manual. Version 1.0. Utah State University Restoration Consortium. Logan, UT. 286 pp. DOI: 10.13140/RG.2.2.19590.63049/2.</Citation>
    <Author>Jordan Gilbert</Author>
    <CreationDate>2024-09-01</CreationDate>
    <UpdatedDate>2024-09-01</UpdatedDate>
    <Metadata>
        <MetadataItem>
            <Name>My Meta</Name>
            <Value>Data</Value>
        </MetadataItem>
    </Metadata>
    <Layers>
        <Layer id="beaver_dam" version="1.0" geom_type="Point">
            <Label>Beaver Dam</Label>
            <Symbology>beaver_dam.qml</Symbology>
            <Description>Beaver Dam Layer</Description>
            <Hierarchy>
                <HierarchyItem>Observations</HierarchyItem>
                <HierarchyItem>Beaver Activity</HierarchyItem>
            </Hierarchy>
            <Fields>
                <Field id="dam_cer" version="1.0" type="list">
                    <Label>Dam CER</Label>
                    <LookupValues>
                        <LookupValue>high</LookupValue>
                        <LookupValue>medium</LookupValue>
                        <LookupValue>low</LookupValue>
                    </LookupValues>
                </Field>
                <Field id="dam_type" version="1.0" type="list">
                    <Label>Dam Type</Label>
                    <LookupValues>
                        <LookupValue>active_dam</LookupValue>
                        <LookupValue>inactive_dam</LookupValue>
                        <LookupValue>relic</LookupValue>
                    </LookupValues>
                </Field>
                <Field id="type_cer" version="1.0" type="list">
                    <Label>Type CER</Label>
                    <LookupValues>
                        <LookupValue>high</LookupValue>
                        <LookupValue>medium</LookupValue>
                        <LookupValue>low</LookupValue>
                    </LookupValues>
                </Field>
            </Fields>
        </Layer>
        <Layer id="beaver_sign" version="1.0" geom_type="Point">
            <Label>Beaver Sign</Label>
            <Symbology>beaver_sign.qml</Symbology>
            <Description>Beaver Sign Layer</Description>
            <Hierarchy>
                <HierarchyItem>Observations</HierarchyItem>
                <HierarchyItem>Beaver Activity</HierarchyItem>
            </Hierarchy>
            <Fields>
                <Field id="sign_type" version="1.0" type="list">
                    <Label>Type</Label>
                    <LookupValues>
                        <LookupValue>bank_den</LookupValue>
                        <LookupValue>bank_lodge</LookupValue>
                        <LookupValue>canal</LookupValue>
                        <LookupValue>chew_stick</LookupValue>
                        <LookupValue>clipped_vegetation</LookupValue>
                        <LookupValue>felled_tree</LookupValue>
                        <LookupValue>food_cache</LookupValue>
                        <LookupValue>harvested_branches</LookupValue>
                        <LookupValue>other</LookupValue>
                        <LookupValue>pond_excavation</LookupValue>
                        <LookupValue>pond_lodge</LookupValue>
                        <LookupValue>scat</LookupValue>
                        <LookupValue>scent_mound</LookupValue>
                        <LookupValue>set_of_tracks</LookupValue>
                        <LookupValue>skid_trail</LookupValue>
                        <LookupValue>slide</LookupValue>
                    </LookupValues>
                </Field>
            </Fields> 
        </Layer>
    </Layers>
</Protocol>
