<Protocol machine_code="TEST_PROTOCOL" version="1.0" status="production" xmlns:xsi="http://www.w3.org/2001/XMLSchema-instance" xsi:noNamespaceSchemaLocation="https://xml.riverscapes.net/QRiS/protocol.xsd">
    <Label>Example Protocol</Label>
    <Description>Example Description</Description>
    <URL>http://example.com</URL>
    <Citation>Example Citation</Citation>
    <Author>Author Name</Author>
    <CreationDate>2023-01-01</CreationDate>
    <UpdatedDate>2023-01-02</UpdatedDate>
    <MetaData>
        <Meta name="Example Metadata">Example Value</Meta>
        <Meta name="Example2">Example value 3</Meta>
    </MetaData>
    <Layers>
        <Layer id="layer1" version="1.0" geom_type="Point">
            <Label>Layer 1</Label>
            <Symbology>Symbology 1</Symbology>
            <Description>Layer 1 Description</Description>
            <Fields>
                <IntegerField id="count_field" version="1.0">
                    <Label>Count Field</Label>
                </IntegerField>
                <TextField id="type_field" version="1.0">
                    <Label>Type Field</Label>
                </TextField>
            </Fields>
        </Layer>
        <Layer id="layer2" version="1.0" geom_type="Polygon">
            <Label>Layer 2</Label>
            <Symbology>Symbology 2</Symbology>
            <Description>Layer 2 Description</Description>
            <Fields>
                <TextField id="type_field" version="1.0">
                    <Label>Type Field</Label>
                </TextField>
            </Fields>
        </Layer>
        <Layer id="layer3" version="1.0" geom_type="Linestring">
            <Label>Layer 3</Label>
            <Symbology>Symbology 3</Symbology>
            <Description>Layer 3 Description</Description>
            <Fields>
                <ListField id="list_field" version="1.0">
                    <Label>List Field</Label>
                    <Values allow_multiple_values="true">
                        <Value>Value 1</Value>
                        <Value>Value 2</Value>
                    </Values>
                </ListField>
                <TextField id="text_field" version="1.0">
                    <Label>Text Field</Label>
                    <Visibility field_id_ref="list_field">
                        <Values>
                            <Value>Value 1</Value>
                        </Values>
                    </Visibility>
                </TextField>
            </Fields>
        </Layer>
        <Layer id="layer4" version="1.0" geom_type="Point">
            <Label>Layer 4 (Slider)</Label>
            <Symbology>Symbology 4</Symbology>
            <Description>Layer 4 Description</Description>
            <Fields>
                <IntegerField id="count_field" version="1.0">
                    <Label>Count Field</Label>
                    <Slider min="0" max="100" step="1"/>
                </IntegerField>
                <TextField id="type_field" version="1.0">
                    <Label>Type Field</Label>
                </TextField>
            </Fields>
        </Layer>
    </Layers>
    <Metrics>
        <Metric id="metric1" version="1.0" calculation_machine_code="count">
            <Label>Metric 1</Label>
            <DefaultLevel>Metric</DefaultLevel>
            <Description>Metric 1 Description</Description>
            <DefinitionURL>http://example.com/metric1</DefinitionURL>
            <MinimumValue>0</MinimumValue>
            <Precision>1</Precision>
            <Parameters>
                <DCELayer layer_id_ref="layer1">
                    <Usage>Denominator</Usage>
                    <CountField field_id_ref="count_field"/>
                    <AttributeFilter field_id_ref="type_Field">
                        <Value>Type 1</Value>
                    </AttributeFilter>
                </DCELayer>
            </Parameters>
        </Metric>
        <Metric id="metric2" version="1.0" calculation_machine_code="count">
            <Label>Metric 2</Label>
            <DefaultLevel>Metric</DefaultLevel>
            <Description>Metric 2 Description</Description>
            <DefinitionURL>http://example.com/metric2</DefinitionURL>
            <MinimumValue>0</MinimumValue>
            <Precision>2</Precision>
            <Parameters>
            <!-- This layer_id_ref should be red -->
                <DCELayer layer_id_ref="layer2_id_does_not_exist">
                    <Usage>Numerator</Usage>
                    <AttributeFilter field_id_ref="type_field">
                        <Value>Type 2</Value>
                    </AttributeFilter>
                </DCELayer>
            </Parameters>
        </Metric>
    </Metrics>
</Protocol>